{
  "schema_version": 3,
  "adventure": {
    "id": "the-siege-of-the-stone-lung",
    "title": "The Siege of the Stone Lung",
    "synopsis": "On the nineteenth day of the siege, Kest Mourne's right gate tower splits from parapet to foundation and the civic lantern above the Pale Gardens burns blue. The Host of the Lower Road has closed every caravan route and driven sappers beneath the walls. First Warden Ilyra Dain answers with a temporary six-lantern commission: cross the city's defensive sectors, spend its last reserves where they can still matter, and carry field truth back into command before the Stone Lung reaches its next crisis.",
    "premise": "An Underdark city is failing by sectors while an enemy host times its assaults to the strokes of the ancient engine that gives the city air. A local, foreign, or mixed company receives bounded authority across six fronts. It must buy military time, distinguish sabotage from structural failure, uncover the old theft beneath the siege, and decide what survival obliges Kest Mourne to restore.",
    "explanation": "The Host came for the Stone Lung, not Kest Mourne's streets. Eighteen years ago, a lethal mold blight forced Kest Mourne to seal the engine's southern branch, cutting the settlement of Lorn away from most of its fresh-air exchange. The quarantine was justified; what followed was not. The blight died, the promised purge and filter works were abandoned, and the council made the closure permanent while falsifying the conduit maps. Lorn survived on auxiliary chimneys until its last reliable shaft collapsed six weeks ago. Marshal Sera Venn sent the original Lorn conduit plate and demanded a joint inspection. Kest Mourne called it a forgery and sealed it beside the old minutes. Venn now intends to seize the Lung and compel a controlled reopening. Her chief engineer, Korr Bas, holds wartime technical command over the Host's resonance corps once its crews reach their work. Certain that delay is another death sentence for Lorn, he has hidden a larger yield and issued Heartstrike orders beyond Venn's limits. Methane-rich black breath has gathered behind the southern masonry; the charge will ignite it and drive flame through the deep galleries of both cities. The commission must keep Kest Mourne alive long enough to expose the old decision, separate Venn's enforceable claim from Bas's catastrophe, and settle whether the Lung will be closed, sacrificed, or made to breathe for both settlements again.",
    "validation": {
      "minimum_clues_per_revelation": 3,
      "minimum_source_encounters_per_revelation": 3,
      "minimum_incoming_clues_per_encounter": 3,
      "minimum_incoming_source_encounters_per_encounter": 3,
      "minimum_outgoing_clues_per_encounter": 3,
      "minimum_distinct_encounter_targets_per_encounter": 3,
      "minimum_edge_connectivity": 3,
      "require_directed_reachability": true
    },
    "tags": {
      "genres": [
        "Siege",
        "Military fantasy",
        "Investigation"
      ],
      "game_systems": [
        "Dungeons & Dragons"
      ],
      "settings": [
        "Underdark",
        "Original fantasy city"
      ],
      "party_size": {
        "minimum": 3,
        "maximum": 5
      },
      "level": {
        "minimum": null,
        "maximum": null
      },
      "combat_intensity": "heavy",
      "keywords": [
        "Sector defense",
        "Resource allocation",
        "Ancient machinery",
        "Civic crisis"
      ]
    }
  },
  "references": [
    {
      "id": "f4f7d2d8-d36a-4156-a898-981753326347",
      "kind": "person",
      "title": "First Warden Ilyra Dain",
      "aliases": [
        "Ilyra Dain",
        "Ilyra",
        "First Warden Dain"
      ],
      "summary": "Kest Mourne's First Warden, a siege commander who lets verified facts reverse orders and whose six-lantern commission crosses sectors without replacing civil or technical authority.",
      "content": "## Six flames, one bounded writ\n\nFirst Warden Ilyra Dain commands Kest Mourne's defense from the Lantern Court. Her six-lantern commission exists because ordinary command stops at sector boundaries while bombardment, air, food, water, and evacuation do not. The writ permits cross-sector movement, bounded requisitions, emergency reallocations, prisoner exchanges, evacuations, and temporary parleys. It does not permit surrender, punishment of civilians, permanent transfer of the Stone Lung, or a technical order that competent crews judge impossible.\n\n## A fact must become an order\n\nIlyra inherited false infrastructure records rather than the decision that made them. She will spend lives to hold defensible ground, but she distrusts gestures that only look resolute. A report matters to her when its source can be tested, its cost can be named, and its conclusion can alter work already under way. She can reverse an order without pretending the first order was wise.\n\n## Emergency command is not ownership\n\nSiege law lets Ilyra direct available reserves, order evacuation and exchange, and bind a temporary operational compact. Permanent joint control of the Lung requires civil process, public records, and recognized Lorn witnesses. Her current orders, allocations, disclosure decision, reserve movement, compact, and willingness to parley remain live adventure state.",
      "tags": [
        "Kest Mourne",
        "Lantern Court",
        "siege command",
        "six-lantern commission"
      ]
    },
    {
      "id": "a3b7aaad-961e-49e0-b33e-a37815d2cffc",
      "kind": "person",
      "title": "Speaker Edda Marr",
      "aliases": [
        "Edda Marr",
        "Edda",
        "Speaker Marr"
      ],
      "summary": "The civil-council speaker who guards Kest Mourne's sealed blight minutes and embodies the difference between a private admission and a correction the whole city must obey.",
      "content": "## Minutes beneath the council seal\n\nSpeaker Edda Marr leads Kest Mourne's civil council. She is the granddaughter of a magistrate who ordered the southern seal during the mold blight and knows that a secret public work was performed. She has protected the sealed minutes because she believes disclosure during a siege would fracture the city and vindicate the Host. Her fear about timing is serious; her defense of concealment is still wrong.\n\n## Six copies or rumor\n\nKest Mourne does not admit a civic fact through one officer's remorse. A correction becomes operative when it enters all six sector ledgers, travels down the command tubes, changes the wall map, and is allowed to alter an order already killing people. Edda's office can release council records and make that civil acknowledgment possible. It cannot make an unexecuted confession binding by itself.\n\n## Civil authority under bombardment\n\nEdda can speak for council procedure, custody of its records, and the public acts by which the city corrects its own account. She does not command the Host, the Gate line, or the Stone Lung's technical crews, and she cannot settle permanent joint control alone. Her current custody, release, reading, copying, publication, and use of the sealed minutes remain live adventure state.",
      "tags": [
        "Kest Mourne",
        "civil council",
        "sealed minutes",
        "public record"
      ]
    },
    {
      "id": "b79f9499-c3d6-40c5-afe0-ec75c1982ec5",
      "kind": "person",
      "title": "Ventwright Tamar Ohn",
      "aliases": [
        "Tamar Ohn",
        "Tamar",
        "Ventwright Ohn"
      ],
      "summary": "Kest Mourne's senior ventwright, responsible for technically executable work on the Stone Lung and entitled to refuse commands that surviving crews and machinery cannot safely perform.",
      "content": "## An engine known by repairs\n\nVentwright Tamar Ohn maintains the accessible parts of the Stone Lung and the civic systems coupled to its strokes. She knows the machine through replaced bearings, improvised braces, seasonal draft, crew habits, and failures absent from formal diagrams. Her authority comes from reproducible work rather than reverence for inherited plans.\n\n## Name the sequence and the crew\n\nTamar treats every remedy as an ordered operation: measure, isolate, brace, vent, move people, turn a control, and verify the next stroke. A military or civil command cannot make missing tools, labor, breathing protection, or pressure limits appear. The six-lantern writ expressly preserves a competent crew's right to reject a technically impossible order.\n\n## Competence is not sovereignty\n\nTamar can judge whether machinery can survive an intervention, organize qualified operators, and state the material conditions a plan requires. She does not own the Lung, decide Lorn's political claim, or command soldiers merely because engineers need a road held. Her current diagnosis, recommendation, measurements, keys, available crew, and chosen remedy remain live adventure state.",
      "tags": [
        "Kest Mourne",
        "ventwrights",
        "Stone Lung",
        "technical authority"
      ]
    },
    {
      "id": "4727a70d-0368-4a88-b86a-b250cc04e3eb",
      "kind": "person",
      "title": "Gate Captain Brann Sile",
      "aliases": [
        "Brann Sile",
        "Brann",
        "Captain Brann"
      ],
      "summary": "The captain responsible for the Shattered Gate, whose practical military authority is measured in defensible ground, named reserves, and minutes bought for the rest of Kest Mourne.",